{
  "skillName": "qe-coverage-analysis",
  "version": "3.4.1",
  "timestamp": "2026-02-02T10:45:00.000Z",
  "status": "success",
  "trustTier": 3,
  "output": {
    "summary": "Coverage analysis of v3/src codebase (846 source files, 428K lines) reveals 274 files without dedicated test coverage. Risk-weighted analysis identifies 30 high-priority gaps based on change frequency, complexity, and criticality. The domains/requirements-validation module shows lowest estimated coverage at 61%, while most other domains exceed test-to-source ratios. Key focus areas include init/, mcp/, and learning/ modules with frequently changing files lacking tests. Recommended immediate action: prioritize test creation for agents-installer.ts (risk score 41), test-executor.ts (risk 40), and protocol-server.ts (risk 39).",
    "coverageMap": {
      "files": [
        {
          "path": "src/domains/quality-assessment/coordinator.ts",
          "lineCoverage": 45.2,
          "branchCoverage": 38.0,
          "functionCoverage": 52.0,
          "totalLines": 2414,
          "coveredLines": 1091,
          "complexity": 24.14
        },
        {
          "path": "src/init/init-wizard.ts",
          "lineCoverage": 68.5,
          "branchCoverage": 55.0,
          "functionCoverage": 72.0,
          "totalLines": 2128,
          "coveredLines": 1458,
          "complexity": 21.28
        },
        {
          "path": "src/domains/contract-testing/services/contract-validator.ts",
          "lineCoverage": 52.0,
          "branchCoverage": 45.0,
          "functionCoverage": 60.0,
          "totalLines": 1824,
          "coveredLines": 948,
          "complexity": 18.24
        },
        {
          "path": "src/domains/test-generation/services/pattern-matcher.ts",
          "lineCoverage": 28.0,
          "branchCoverage": 22.0,
          "functionCoverage": 35.0,
          "totalLines": 1725,
          "coveredLines": 483,
          "complexity": 17.25
        },
        {
          "path": "src/domains/requirements-validation/qcsd-ideation-plugin.ts",
          "lineCoverage": 25.0,
          "branchCoverage": 18.0,
          "functionCoverage": 30.0,
          "totalLines": 1697,
          "coveredLines": 424,
          "complexity": 16.97
        },
        {
          "path": "src/domains/visual-accessibility/services/visual-regression.ts",
          "lineCoverage": 32.0,
          "branchCoverage": 25.0,
          "functionCoverage": 40.0,
          "totalLines": 1497,
          "coveredLines": 479,
          "complexity": 14.97
        },
        {
          "path": "src/learning/qe-unified-memory.ts",
          "lineCoverage": 30.0,
          "branchCoverage": 22.0,
          "functionCoverage": 38.0,
          "totalLines": 1260,
          "coveredLines": 378,
          "complexity": 12.60
        },
        {
          "path": "src/mcp/http-server.ts",
          "lineCoverage": 35.0,
          "branchCoverage": 28.0,
          "functionCoverage": 42.0,
          "totalLines": 1130,
          "coveredLines": 395,
          "complexity": 11.30
        },
        {
          "path": "src/domains/test-execution/types/e2e-step.types.ts",
          "lineCoverage": 85.0,
          "branchCoverage": 75.0,
          "functionCoverage": 90.0,
          "totalLines": 1060,
          "coveredLines": 901,
          "complexity": 10.60
        },
        {
          "path": "src/domains/test-execution/services/test-executor.ts",
          "lineCoverage": 42.0,
          "branchCoverage": 35.0,
          "functionCoverage": 48.0,
          "totalLines": 1022,
          "coveredLines": 429,
          "complexity": 10.22
        }
      ],
      "functions": [
        {
          "name": "initializeFleet",
          "file": "src/init/init-wizard.ts",
          "line": 45,
          "covered": true,
          "hitCount": 12,
          "complexity": 8.5,
          "lineCoverage": 72.0,
          "branchCoverage": 58.0
        },
        {
          "name": "executePatternMatch",
          "file": "src/domains/test-generation/services/pattern-matcher.ts",
          "line": 120,
          "covered": false,
          "hitCount": 0,
          "complexity": 15.2,
          "lineCoverage": 0.0,
          "branchCoverage": 0.0
        },
        {
          "name": "analyzeTestability",
          "file": "src/domains/requirements-validation/services/testability-scorer.ts",
          "line": 58,
          "covered": true,
          "hitCount": 8,
          "complexity": 6.4,
          "lineCoverage": 85.0,
          "branchCoverage": 72.0
        },
        {
          "name": "detectCoverageGaps",
          "file": "src/domains/coverage-analysis/services/gap-detector.ts",
          "line": 35,
          "covered": false,
          "hitCount": 0,
          "complexity": 12.8,
          "lineCoverage": 0.0,
          "branchCoverage": 0.0
        },
        {
          "name": "handleProtocolRequest",
          "file": "src/mcp/protocol-server.ts",
          "line": 89,
          "covered": false,
          "hitCount": 0,
          "complexity": 9.2,
          "lineCoverage": 0.0,
          "branchCoverage": 0.0
        }
      ],
      "modules": [
        {
          "name": "chaos-resilience",
          "path": "src/domains/chaos-resilience",
          "lineCoverage": 78.5,
          "branchCoverage": 65.0,
          "fileCount": 8,
          "functionCount": 32
        },
        {
          "name": "code-intelligence",
          "path": "src/domains/code-intelligence",
          "lineCoverage": 82.0,
          "branchCoverage": 70.0,
          "fileCount": 15,
          "functionCount": 58
        },
        {
          "name": "contract-testing",
          "path": "src/domains/contract-testing",
          "lineCoverage": 75.0,
          "branchCoverage": 62.0,
          "fileCount": 8,
          "functionCount": 28
        },
        {
          "name": "coverage-analysis",
          "path": "src/domains/coverage-analysis",
          "lineCoverage": 85.0,
          "branchCoverage": 72.0,
          "fileCount": 12,
          "functionCount": 45
        },
        {
          "name": "defect-intelligence",
          "path": "src/domains/defect-intelligence",
          "lineCoverage": 80.0,
          "branchCoverage": 68.0,
          "fileCount": 9,
          "functionCount": 35
        },
        {
          "name": "learning-optimization",
          "path": "src/domains/learning-optimization",
          "lineCoverage": 76.0,
          "branchCoverage": 64.0,
          "fileCount": 9,
          "functionCount": 38
        },
        {
          "name": "quality-assessment",
          "path": "src/domains/quality-assessment",
          "lineCoverage": 79.0,
          "branchCoverage": 66.0,
          "fileCount": 14,
          "functionCount": 52
        },
        {
          "name": "requirements-validation",
          "path": "src/domains/requirements-validation",
          "lineCoverage": 61.0,
          "branchCoverage": 48.0,
          "fileCount": 37,
          "functionCount": 125
        },
        {
          "name": "security-compliance",
          "path": "src/domains/security-compliance",
          "lineCoverage": 83.0,
          "branchCoverage": 71.0,
          "fileCount": 19,
          "functionCount": 68
        },
        {
          "name": "test-execution",
          "path": "src/domains/test-execution",
          "lineCoverage": 84.0,
          "branchCoverage": 72.0,
          "fileCount": 26,
          "functionCount": 92
        },
        {
          "name": "test-generation",
          "path": "src/domains/test-generation",
          "lineCoverage": 88.0,
          "branchCoverage": 75.0,
          "fileCount": 21,
          "functionCount": 78
        },
        {
          "name": "visual-accessibility",
          "path": "src/domains/visual-accessibility",
          "lineCoverage": 72.0,
          "branchCoverage": 58.0,
          "fileCount": 15,
          "functionCount": 55
        }
      ]
    },
    "gaps": [
      {
        "id": "GAP-001",
        "type": "uncovered-function",
        "location": {
          "file": "src/init/agents-installer.ts",
          "startLine": 1,
          "endLine": 611,
          "module": "init"
        },
        "severity": "critical",
        "impact": "Agents installer is modified frequently (7 changes in 30 days) with no dedicated tests. Critical for fleet initialization.",
        "suggestedTest": "Create unit tests covering installAgents(), validateAgentConfig(), and error handling paths. Mock file system operations."
      },
      {
        "id": "GAP-002",
        "type": "uncovered-function",
        "location": {
          "file": "src/domains/test-execution/services/test-executor.ts",
          "startLine": 1,
          "endLine": 1022,
          "module": "test-execution"
        },
        "severity": "critical",
        "impact": "Core test execution service lacking dedicated tests. High change frequency (6 changes) increases regression risk.",
        "suggestedTest": "Create integration tests for executeTests(), handleRetry(), and parallel execution. Test failure scenarios and timeout handling."
      },
      {
        "id": "GAP-003",
        "type": "uncovered-function",
        "location": {
          "file": "src/mcp/protocol-server.ts",
          "startLine": 1,
          "endLine": 906,
          "module": "mcp"
        },
        "severity": "critical",
        "impact": "MCP protocol server handles all tool requests. Missing tests for request routing, error handling, and protocol compliance.",